{
  "gameInfo": {
    "name": "Simple Card Battle",
    "description": "A basic trading card game where players summon creatures and cast spells to defeat their opponent",
    "playerCount": 2,
    "initialPlayerHealth": 30
  },
  "cardProperties": {
    "baseProperties": ["name", "cost", "attack", "health", "description"],
    "types": ["Creature", "Spell", "Item"],
    "customProperties": [
      {
        "name": "taunt",
        "type": "boolean",
        "description": "Enemies must attack this creature if present",
        "defaultValue": false
      },
      {
        "name": "rush",
        "type": "boolean",
        "description": "Can attack the turn it is played",
        "defaultValue": false
      }
    ]
  },
  "zones": [
    {
      "name": "Deck",
      "perPlayer": true,
      "isPublic": false,
      "isOrdered": true,
      "maxCards": -1,
      "startingCards": 30
    },
    {
      "name": "Hand",
      "perPlayer": true,
      "isPublic": false,
      "isOrdered": false,
      "maxCards": 10,
      "startingCards": 0
    },
    {
      "name": "Field",
      "perPlayer": true,
      "isPublic": true,
      "isOrdered": false,
      "maxCards": 7,
      "startingCards": 0
    },
    {
      "name": "Discard",
      "perPlayer": true,
      "isPublic": true,
      "isOrdered": true,
      "maxCards": -1,
      "startingCards": 0
    }
  ],
  "turnStructure": {
    "phases": [
      {
        "name": "Start",
        "description": "Begin your turn and draw a card",
        "allowedActions": ["drawCard"]
      },
      {
        "name": "Main",
        "description": "Play cards and use abilities",
        "allowedActions": ["playCard", "useAbility"]
      },
      {
        "name": "Combat",
        "description": "Attack with your creatures",
        "allowedActions": ["attack"]
      },
      {
        "name": "End",
        "description": "End your turn",
        "allowedActions": []
      }
    ],
    "firstPlayerDraws": 3,
    "normalDrawCount": 1,
    "resourceSystem": {
      "type": "mana",
      "startingAmount": 1,
      "maxAmount": 10,
      "gainPerTurn": 1
    }
  },
  "winConditions": [
    {
      "type": "healthReduction",
      "description": "Reduce your opponent's health to zero",
      "threshold": 0
    },
    {
      "type": "deckDepletion",
      "description": "Your opponent loses if they need to draw a card but have none left",
      "threshold": 0
    }
  ]
}
